{
  "schema": "depguard.report.v2",
  "tool": {
    "name": "depguard",
    "version": "__VERSION__"
  },
  "run": {
    "started_at": "__TIMESTAMP__",
    "ended_at": "__TIMESTAMP__",
    "duration_ms": 0
  },
  "verdict": {
    "status": "fail",
    "counts": {
      "info": 0,
      "warn": 0,
      "error": 1
    },
    "reasons": []
  },
  "findings": [
    {
      "severity": "error",
      "check_id": "deps.no_wildcards",
      "code": "wildcard_version",
      "message": "dependency 'tokio' uses a wildcard version: *",
      "location": {
        "path": "Cargo.toml",
        "line": 8
      },
      "help": "Replace wildcard versions with an explicit semver requirement.",
      "fingerprint": "69e7c6b5c9bbc1118676dd135361e63e49399598b85559646cd865fcac66708a",
      "data": {
        "current_spec": {
          "version": "*"
        },
        "dependency": "tokio",
        "fix_action": "pin_version",
        "fix_hint": "Pin to a specific semver requirement",
        "manifest": "Cargo.toml",
        "section": "dependencies"
      }
    }
  ],
  "data": {
    "scope": "repo",
    "profile": "strict",
    "manifests_scanned": 1,
    "dependencies_scanned": 2,
    "findings_total": 1,
    "findings_emitted": 1
  }
}
