{
  "schema": "depguard.report.v2",
  "tool": {
    "name": "depguard",
    "version": "0.1.0"
  },
  "run": {
    "started_at": "__TIMESTAMP__",
    "ended_at": "__TIMESTAMP__",
    "duration_ms": 0
  },
  "verdict": {
    "status": "fail",
    "counts": {
      "info": 0,
      "warn": 0,
      "error": 1
    },
    "reasons": []
  },
  "findings": [
    {
      "severity": "error",
      "check_id": "deps.path_requires_version",
      "code": "path_without_version",
      "message": "dependency 'my-local' uses a path dependency without an explicit version",
      "location": {
        "path": "Cargo.toml",
        "line": 8
      },
      "help": "Add an explicit version alongside `path = ...`, or use `workspace = true` with a workspace dependency.",
      "fingerprint": "f757d47212dd098c613d6bc121c093ca5f76e5f600a0e666e29f69ef78713e9b",
      "data": {
        "dependency": "my-local",
        "manifest": "Cargo.toml",
        "path": "../my-local"
      }
    }
  ],
  "data": {
    "scope": "repo",
    "profile": "strict",
    "manifests_scanned": 1,
    "dependencies_scanned": 1,
    "findings_total": 1,
    "findings_emitted": 1
  }
}
