{
  "schema": "depguard.report.v2",
  "tool": {
    "name": "depguard",
    "version": "__VERSION__"
  },
  "run": {
    "started_at": "__TIMESTAMP__",
    "ended_at": "__TIMESTAMP__",
    "duration_ms": 0
  },
  "verdict": {
    "status": "fail",
    "counts": {
      "info": 0,
      "warn": 0,
      "error": 1
    },
    "reasons": []
  },
  "findings": [
    {
      "severity": "error",
      "check_id": "deps.path_requires_version",
      "code": "path_without_version",
      "message": "dependency 'local-lib' uses a path dependency without an explicit version",
      "location": {
        "path": "Cargo.toml",
        "line": 21
      },
      "help": "Add an explicit version alongside `path = ...`, or use `workspace = true` with a workspace dependency.",
      "fingerprint": "ec30f0af57775e66c726c0a09db9d0265a8f5b9e8467fbb7942c7f5aa483f0c9",
      "data": {
        "current_spec": {
          "path": "./libs/local-lib"
        },
        "dependency": "local-lib",
        "fix_action": "add_version",
        "fix_hint": "Add version alongside the path dependency",
        "manifest": "Cargo.toml",
        "section": "dependencies"
      }
    }
  ],
  "data": {
    "scope": "repo",
    "profile": "strict",
    "manifests_scanned": 1,
    "dependencies_scanned": 1,
    "findings_total": 1,
    "findings_emitted": 1
  }
}
