{
  "schema": "depguard.report.v2",
  "tool": {
    "name": "depguard",
    "version": "0.1.0"
  },
  "run": {
    "started_at": "__TIMESTAMP__",
    "ended_at": "__TIMESTAMP__",
    "duration_ms": 0
  },
  "verdict": {
    "status": "pass",
    "counts": {
      "info": 0,
      "warn": 0,
      "error": 0
    },
    "reasons": []
  },
  "findings": [],
  "data": {
    "scope": "repo",
    "profile": "strict",
    "manifests_scanned": 6,
    "dependencies_scanned": 5,
    "findings_total": 0,
    "findings_emitted": 0
  }
}
